{
  "target": "cate",
  "design_route": "observational_unconfounded",
  "data_source": "observational",
  "treatment_type": "binary",
  "outcome_type": "continuous",
  "modifier_timing": "baseline",
  "prespecification": "exploratory",
  "overlap_status": "limited",
  "n_samples": 4000,
  "n_features": 40,
  "n_subgroups": null,
  "need_interpretability": "moderate",
  "language": "python",
  "high_stakes": false,
  "has_holdout_or_crossfit_plan": true
}
